coordinates,created_at,created_d,created_h,created_m,created_min,created_y,favorite_count,id,lang,retweet_count,source,text
,,7.0,15.0,1.0,10.0,2017.0,76047.0,817750330196819968,en,18146.0,Twitter for Android,"have enough problems around the world without yet another one. When I am President, Russia will respect us far more than they do now and...."
,,7.0,15.0,1.0,2.0,2017.0,97981.0,817748207694467072,en,28535.0,Twitter for Android,"Having a good relationship with Russia is a good thing, not a bad thing. Only ""stupid"" people, or fools, would think that it is bad! We....."
,,7.0,12.0,1.0,3.0,2017.0,81739.0,817703208567078913,en,19252.0,Twitter for Android,Only reason the hacking of the poorly defended DNC is discussed is that the loss by the Dems was so big that they are totally embarrassed!
,,7.0,11.0,1.0,56.0,2017.0,67053.0,817701436096126977,en,17791.0,Twitter for Android,Intelligence stated very strongly there was absolutely no evidence that hacking affected the election results. Voting machines not touched!
,,7.0,3.0,1.0,53.0,2017.0,65898.0,817579925771341825,en,16107.0,Twitter for Android,Gross negligence by the Democratic National Committee allowed hacking to take place.The Republican National Committee had strong defense!
,,7.0,0.0,1.0,7.0,2017.0,47019.0,817522928862502913,en,7633.0,Twitter for iPhone,"Happy Birthday @EricTrump!
https://t.co/bJaEY7qFSn"
,,6.0,19.0,1.0,30.0,2017.0,93761.0,817453219613917185,en,21692.0,Twitter Web Client,Monitoring the terrible situation in Florida. Just spoke to Governor Scott. Thoughts and prayers for all. Stay safe!
,,6.0,16.0,1.0,51.0,2017.0,90054.0,817413321058029568,en,25433.0,Twitter for iPhone,I am asking the chairs of the House and Senate committees to investigate top secret intelligence shared with NBC prior to me seeing it.
,,6.0,14.0,1.0,18.0,2017.0,34030.0,817374875962769408,en,6324.0,Twitter for iPhone,"Anna Wintour came to my office at Trump Tower to ask me to meet with the editors of Conde Nast &amp; Steven Newhouse, a friend. Will go this AM."
,,6.0,12.0,1.0,42.0,2017.0,39785.0,817350726800306177,en,8592.0,Twitter for Android,"being a movie star-and that was season 1 compared to season 14. Now compare him to my season 1. But who cares, he supported Kasich &amp; Hillary"
,,6.0,12.0,1.0,34.0,2017.0,37832.0,817348644647108609,en,9079.0,Twitter for Android,"Wow, the ratings are in and Arnold Schwarzenegger got ""swamped"" (or destroyed) by comparison to the ratings machine, DJT. So much for...."
,,6.0,12.0,1.0,5.0,2017.0,64512.0,817341196251070464,en,14089.0,Twitter for Android,"Hopefully, all supporters, and those who want to MAKE AMERICA GREAT AGAIN, will go to D.C. on January 20th. It will be a GREAT SHOW!"
,,6.0,11.0,1.0,45.0,2017.0,40423.0,817336355193753600,en,8110.0,Twitter for Android,and knew they were in big trouble - which is why they cancelled their big fireworks at the last minute.THEY SAW A MOVEMENT LIKE NEVER BEFORE
,,6.0,11.0,1.0,39.0,2017.0,50014.0,817334794958807042,en,10353.0,Twitter for Android,Hillary and the Dems were never going to beat the PASSION of my voters. They saw what was happening in the last two weeks before the......
,,6.0,11.0,1.0,19.0,2017.0,64060.0,817329823374831617,en,18691.0,Twitter for Android,"The dishonest media does not report that any money spent on building the Great Wall (for sake of speed), will be paid back by Mexico later!"
,,6.0,0.0,1.0,40.0,2017.0,69354.0,817168818539757568,en,20491.0,Twitter for Android,So how and why are they so sure about hacking if they never even requested an examination of the computer servers? What is going on?
,,6.0,0.0,1.0,30.0,2017.0,55552.0,817166353266262016,en,18352.0,Twitter for Android,The Democratic National Committee would not allow the FBI to study or see its computer info after it was supposedly hacked by Russia......
,,6.0,0.0,1.0,24.0,2017.0,66238.0,817164923843280896,en,20158.0,Twitter for Android,"How did NBC get ""an exclusive look into the top secret report he (Obama) was presented?"" Who gave them this report and why? Politics!"
,,5.0,18.0,1.0,14.0,2017.0,104998.0,817071792711942145,en,31302.0,Twitter for Android,"Toyota Motor said will build a new plant in Baja, Mexico, to build Corolla cars for U.S. NO WAY! Build plant in U.S. or pay big border tax."
,,5.0,13.0,1.0,45.0,2017.0,66131.0,817004210529116160,en,14999.0,Twitter for Android,"to make up their own minds as to the truth. The media lies to make it look like I am against ""Intelligence"" when in fact I am a big fan!"
,,5.0,13.0,1.0,25.0,2017.0,60240.0,816999062562107392,en,15980.0,Twitter for Android,"The dishonest media likes saying that I am in Agreement with Julian Assange - wrong. I simply state what he states, it is for the people...."
,,5.0,12.0,1.0,6.0,2017.0,76484.0,816979231217483776,en,16187.0,Twitter for Android,...time for Republicans &amp; Democrats to get together and come up with a healthcare plan that really works - much less expensive &amp; FAR BETTER!
,,5.0,12.0,1.0,1.0,2017.0,50346.0,816977937731878912,en,11990.0,Twitter for Android,"...do the typical political thing and BLAME. The fact is ObamaCare was a lie from the beginning.""Keep you doctor, keep your plan!"" It is...."
,,5.0,11.0,1.0,57.0,2017.0,51820.0,816977032433270784,en,12801.0,Twitter for Android,"The Democrats, lead by head clown Chuck Schumer, know how bad ObamaCare is and what a mess they are in. Instead of working to fix it, they.."
,,4.0,18.0,1.0,52.0,2017.0,77438.0,816718880731234304,en,16754.0,Twitter Web Client,"Jackie Evancho's album sales have skyrocketed after announcing her Inauguration performance.Some people just don't understand the ""Movement"""
,,4.0,14.0,1.0,26.0,2017.0,52702.0,816652088662958082,en,13331.0,Twitter for Android,massive increases of ObamaCare will take place this year and Dems are to blame for the mess. It will fall of its own weight - be careful!
,,4.0,14.0,1.0,1.0,2017.0,45222.0,816645831659061248,en,11028.0,Twitter for Android,"like the 116% hike in Arizona. Also, deductibles are so high that it is practically useless. Don't let the Schumer clowns out of this web..."
,,4.0,13.0,1.0,55.0,2017.0,44965.0,816644321768312832,en,10929.0,Twitter for Android,"Republicans must be careful in that the Dems own the failed ObamaCare disaster, with its poor coverage and massive premium increases......"
,,4.0,13.0,1.0,31.0,2017.0,45194.0,816638194468999169,en,10497.0,Twitter for Android,"things they did and said (like giving the questions to the debate to H). A total double standard! Media, as usual, gave them a pass."
,,4.0,13.0,1.0,27.0,2017.0,41377.0,816637064708030464,en,10051.0,Twitter for Android,"Somebody hacked the DNC but why did they not have ""hacking defense"" like the RNC has and why have they not responded to the terrible......"
,,4.0,13.0,1.0,19.0,2017.0,84405.0,816635078067490816,en,19069.0,Twitter for Android,Thank you to Ford for scrapping a new plant in Mexico and creating 700 new jobs in the U.S. This is just the beginning - much more to follow
,,4.0,13.0,1.0,10.0,2017.0,40829.0,816632793862176769,en,14509.0,Twitter for Android,"""@FoxNews: Julian Assange on U.S. media coverage: “It’s very dishonest.” #Hannity https://t.co/ADcPRQifH9"" More dishonest than anyone knows"
,,4.0,12.0,1.0,22.0,2017.0,59363.0,816620855958601730,en,17770.0,Twitter for Android,"Julian Assange said ""a 14 year old could have hacked Podesta"" - why was DNC so careless? Also said Russians did not give him the info!"
,,4.0,1.0,1.0,14.0,2017.0,77732.0,816452807024840704,en,22931.0,Twitter for Android,"The ""Intelligence"" briefing on so-called ""Russian hacking"" was delayed until Friday, perhaps more time needed to build a case. Very strange!"
,,3.0,23.0,1.0,58.0,2017.0,56204.0,816433590892429312,en,14388.0,Twitter for Android,I will be having a general news conference on JANUARY ELEVENTH in N.Y.C. Thank you.
,,3.0,18.0,1.0,44.0,2017.0,51741.0,816354639859871745,en,13795.0,Twitter for iPhone,"""Trump is already delivering the jobs he promised America"" https://t.co/11spTMa6Tm"
,,3.0,17.0,1.0,20.0,2017.0,80930.0,816333480409833472,en,20306.0,Twitter for Android,There should be no further releases from Gitmo. These are extremely dangerous people and should not be allowed back onto the battlefield.
,,3.0,17.0,1.0,0.0,2017.0,53416.0,816328314759606272,en,12515.0,Twitter for iPhone,"Instead of driving jobs and wealth away, AMERICA will become the world's great magnet for INNOVATION &amp; JOB CREATION.
https://t.co/siXrptsOrt"
,,3.0,16.0,1.0,44.0,2017.0,51479.0,816324295781740544,en,15233.0,Twitter for iPhone,"""@DanScavino: Ford to scrap Mexico plant, invest in Michigan due to Trump policies""
https://t.co/137nUo03Gl"
,,3.0,15.0,1.0,7.0,2017.0,41653.0,816300003442495488,en,9324.0,Twitter for Android,"........may be, their number one act and priority. Focus on tax reform, healthcare and so many other things of far greater importance! #DTS"
,,3.0,15.0,1.0,3.0,2017.0,41887.0,816298944456232960,en,10619.0,Twitter for Android,"With all that Congress has to work on, do they really have to make the weakening of the Independent Ethics Watchdog, as unfair as it"
,,3.0,12.0,1.0,51.0,2017.0,51996.0,816265668958031872,en,12339.0,Twitter for Android,"The Democrat Governor.of Minnesota said ""The Affordable Care Act (ObamaCare) is no longer affordable!"" - And, it is lousy healthcare."
,,3.0,12.0,1.0,46.0,2017.0,57238.0,816264484629184513,en,14166.0,Twitter for Android,"People must remember that ObamaCare just doesn't work, and it is not affordable - 116% increases (Arizona). Bill Clinton called it ""CRAZY"""
,,3.0,12.0,1.0,30.0,2017.0,71155.0,816260343391514624,en,18438.0,Twitter for Android,General Motors is sending Mexican made model of Chevy Cruze to U.S. car dealers-tax free across border. Make in U.S.A.or pay big border tax!
,,2.0,23.0,1.0,47.0,2017.0,62682.0,816068355555815424,en,17147.0,Twitter for Android,"China has been taking out massive amounts of money &amp; wealth from the U.S. in totally one-sided trade, but won't help with North Korea. Nice!"
,,2.0,23.0,1.0,5.0,2017.0,90267.0,816057920223846400,en,26262.0,Twitter for Android,North Korea just stated that it is in the final stages of developing a nuclear weapon capable of reaching parts of the U.S. It won't happen!
,,2.0,18.0,1.0,44.0,2017.0,60958.0,815992069412057088,en,13114.0,Twitter for Android,"I thought and felt I would win big, easily over the fabled 270 (306). When they cancelled fireworks, they knew, and so did I."
,,2.0,18.0,1.0,37.0,2017.0,45994.0,815990335318982656,en,8878.0,Twitter for Android,"Various media outlets and pundits say that I thought I was going to lose the election. Wrong, it all came together in the last week and....."
,,2.0,18.0,1.0,32.0,2017.0,13441.0,815989154555297792,en,3877.0,Twitter for Android,"@CNN just released a book called ""Unprecedented"" which explores the 2016 race &amp; victory. Hope it does well but used worst cover photo of me!"
,,2.0,17.0,1.0,31.0,2017.0,61635.0,815973752785793024,en,17007.0,Twitter for Android,"Chicago murder rate is record setting - 4,331 shooting victims with 762 murders in 2016. If Mayor can't do it he must ask for Federal help!"
,,2.0,14.0,1.0,40.0,2017.0,121193.0,815930688889352192,en,28553.0,Twitter for Android,"Well, the New Year begins. We will, together, MAKE AMERICA GREAT AGAIN!"
,,1.0,6.0,1.0,49.0,2017.0,0.0,815449933453127681,en,13393.0,Twitter for iPhone,"RT @IvankaTrump: 2016 has been one of the most eventful and exciting years of my life. I wish you peace, joy, love and laughter. Happy New…"
,,1.0,6.0,1.0,49.0,2017.0,0.0,815449868739211265,en,6701.0,Twitter for iPhone,RT @DonaldJTrumpJr: Happy new year everyone. #newyear #family #vacation #familytime https://t.co/u9fJIKNoZq
,,1.0,5.0,1.0,44.0,2017.0,0.0,815433444591304704,en,6786.0,Twitter for iPhone,RT @EricTrump: 2016 was such an incredible year for our entire family! My beautiful wife @LaraLeaTrump made it even better! 🇺🇸🇺🇸 https://t.…
,,1.0,5.0,1.0,43.0,2017.0,0.0,815433217595547648,en,6988.0,Twitter for iPhone,RT @Reince: Happy New Year + God's blessings to you all.  Looking forward to incredible things in 2017!  @realDonaldTrump will Make America…
,,1.0,5.0,1.0,39.0,2017.0,0.0,815432169464197121,en,5448.0,Twitter for iPhone,"RT @DanScavino: On behalf of our next #POTUS &amp; @TeamTrump-

#HappyNewYear AMERICA🇺🇸

https://t.co/Y6XDdijXea
https://t.co/D8plL7xHql
https:…"
,,1.0,5.0,1.0,0.0,2017.0,123478.0,815422340540547073,en,31943.0,Twitter for iPhone,"TO ALL AMERICANS-
#HappyNewYear &amp; many blessings to you all! Looking forward to a wonderful &amp; prosperous 2017 as we… https://t.co/1asdMAL4iy"
,,31.0,18.0,12.0,59.0,2016.0,0.0,815271067749060609,en,9209.0,Twitter for iPhone,"RT @realDonaldTrump: Happy Birthday @DonaldJTrumpJr!
https://t.co/uRxyCD3hBz"
,,31.0,18.0,12.0,58.0,2016.0,53347.0,815270850916208644,en,9209.0,Twitter for iPhone,"Happy Birthday @DonaldJTrumpJr!
https://t.co/uRxyCD3hBz"
,,31.0,13.0,12.0,17.0,2016.0,339958.0,815185071317676033,en,135856.0,Twitter for Android,"Happy New Year to all, including to my many enemies and those who have fought me and lost so badly they just don't know what to do. Love!"
,,30.0,22.0,12.0,18.0,2016.0,80388.0,814958820980039681,en,22245.0,Twitter for Android,"Russians are playing @CNN and @NBCNews for such fools - funny to watch, they don't have a clue! @FoxNews totally gets it!"
,,30.0,19.0,12.0,46.0,2016.0,24125.0,814920722208296960,en,7118.0,Twitter for iPhone,"Join @AmerIcan32, founded by Hall of Fame legend @JimBrownNFL32 on 1/19/2017 in Washington, D.C.… https://t.co/9WJZ8iTCQV"
,,30.0,19.0,12.0,41.0,2016.0,93115.0,814919370711461890,en,33409.0,Twitter for Android,Great move on delay (by V. Putin) - I always knew he was very smart!
,,29.0,14.0,12.0,54.0,2016.0,43519.0,814484710025994241,en,10892.0,Twitter for iPhone,My Administration will follow two simple rules: https://t.co/ZWk0j4H8Qy
,,28.0,22.0,12.0,6.0,2016.0,49645.0,814231064847728640,en,13406.0,Twitter for iPhone,'Economists say Trump delivered hope' https://t.co/SjGBgglIuQ
,,28.0,14.0,12.0,25.0,2016.0,113106.0,814114980983427073,en,33101.0,Twitter for Android,"not anymore. The beginning of the end was the horrible Iran deal, and now this (U.N.)! Stay strong Israel, January 20th is fast approaching!"
,,28.0,14.0,12.0,19.0,2016.0,102621.0,814113616110751744,en,29022.0,Twitter for Android,"We cannot continue to let Israel be treated with such total disdain and disrespect. They used to have a great friend in the U.S., but......."
,,28.0,14.0,12.0,7.0,2016.0,112954.0,814110460761018368,en,30443.0,Twitter for Android,Doing my best to disregard the many inflammatory President O statements and roadblocks.Thought it was going to be a smooth transition - NOT!
,,28.0,3.0,12.0,10.0,2016.0,75099.0,813945096269860866,en,18268.0,Twitter for Android,"The U.S. Consumer Confidence Index for December surged nearly four points to 113.7, THE HIGHEST LEVEL IN MORE THAN 15 YEARS! Thanks Donald!"
,,27.0,21.0,12.0,52.0,2016.0,95702.0,813865160163098628,en,22275.0,Twitter for Android,"President Obama campaigned hard (and personally) in the very important swing states, and lost.The voters wanted to MAKE AMERICA GREAT AGAIN!"
,,27.0,3.0,12.0,6.0,2016.0,64643.0,813581917215977473,en,14762.0,Twitter for Android,"The DJT Foundation, unlike most foundations, never paid fees, rent, salaries or any expenses. 100% of money goes to wonderful charities!"
,,27.0,2.0,12.0,53.0,2016.0,68656.0,813578484572450816,en,16839.0,Twitter for Android,"I gave millions of dollars to DJT Foundation, raised or recieved millions more, ALL of which is given to charity, and media won't report!"
,,26.0,23.0,12.0,32.0,2016.0,123177.0,813527932165558273,en,28747.0,Twitter for iPhone,The world was gloomy before I won - there was no hope. Now the market is up nearly 10% and Christmas spending is over a trillion dollars!
,,26.0,21.0,12.0,41.0,2016.0,74469.0,813500123053490176,en,21271.0,Twitter for Android,"The United Nations has such great potential but right now it is just a club for people to get together, talk and have a good time. So sad!"
,,26.0,21.0,12.0,36.0,2016.0,87377.0,813498739923054593,en,21279.0,Twitter for Android,"President Obama said that he thinks he would have won against me. He should say that but I say NO WAY! - jobs leaving, ISIS, OCare, etc."
,,25.0,17.0,12.0,48.0,2016.0,204188.0,813079058896535552,en,47732.0,Twitter for Android,"Merry Christmas and a very, very, very , very Happy New Year to everyone!"
,,25.0,12.0,12.0,46.0,2016.0,145666.0,813003030186622976,und,40482.0,Twitter for iPhone,#MerryChristmas https://t.co/5GgDmJrGMS
,,24.0,21.0,12.0,44.0,2016.0,80978.0,812775995837218816,en,21043.0,Twitter for iPhone,Happy #Hanukkah https://t.co/UvZwtykV1E
,,24.0,21.0,12.0,33.0,2016.0,80109.0,812773204561379330,en,18980.0,Twitter for Android,"The big loss yesterday for Israel in the United Nations will make it much harder to negotiate peace.Too bad, but we will get it done anyway!"
,,24.0,20.0,12.0,59.0,2016.0,59999.0,812764662500622336,en,15960.0,Twitter for Android,".@NBCNews purposely left out this part of my nuclear qoute: ""until such time as the world comes to its senses regarding nukes.""  Dishonest!"
,,24.0,0.0,12.0,13.0,2016.0,107454.0,812450976670121985,en,30128.0,Twitter for Android,"Vladimir Putin said today about Hillary and Dems: ""In my opinion, it is humiliating. One must be able to lose with dignity.""  So true!"
,,23.0,21.0,12.0,23.0,2016.0,62507.0,812408189492797442,en,17084.0,Twitter for Android,"slaughter you. This is a purely religious threat, which turned into reality. Such hatred! When will the U.S., and all countries, fight back?"
,,23.0,21.0,12.0,17.0,2016.0,48838.0,812406855469252608,en,17915.0,Twitter for Android,"The terrorist who killed so many people in Germany said just before crime, ""by God's will we will slaughter you pigs, I swear, we will......"
,,23.0,20.0,12.0,14.0,2016.0,94473.0,812390964740427776,en,32496.0,Twitter for iPhone,"As to the U.N., things will be different after Jan. 20th."
,,23.0,11.0,12.0,58.0,2016.0,61740.0,812266152684650496,en,13963.0,Twitter for Android,"my presidency. Isn't this a ridiculous shame? He loves these kids, has raised millions of dollars for them, and now must stop. Wrong answer!"
,,23.0,11.0,12.0,53.0,2016.0,51730.0,812264762981675008,en,14909.0,Twitter for Android,"My wonderful son, Eric, will no longer be allowed to raise money for children with cancer because of a possible conflict of interest with..."
,,23.0,1.0,12.0,59.0,2016.0,114810.0,812115501791006720,en,29968.0,Twitter for Android,"The so-called ""A"" list celebrities are all wanting tixs to the inauguration, but look what they did for Hillary, NOTHING. I want the PEOPLE!"
,,22.0,22.0,12.0,26.0,2016.0,59851.0,812061677160202240,en,14329.0,Twitter for Android,"Based on the tremendous cost and cost overruns of the Lockheed Martin F-35, I have asked Boeing to price-out a comparable F-18 Super Hornet!"
,,22.0,16.0,12.0,50.0,2016.0,69824.0,811977223326625792,en,20340.0,Twitter for Android,The United States must greatly strengthen and expand its nuclear capability until such time as the world comes to its senses regarding nukes
,,22.0,16.0,12.0,41.0,2016.0,70694.0,811975049431416832,en,18514.0,Twitter for Android,"Someone incorrectly stated that the phrase ""DRAIN THE SWAMP"" was no longer being used by me. Actually, we will always be trying to DTS."
,,22.0,13.0,12.0,37.0,2016.0,34155.0,811928543366148096,en,9995.0,Twitter for iPhone,The resolution being considered at the United Nations Security Council regarding Israel should be vetoed....cont: https://t.co/s8rXKKZNF1
,,22.0,3.0,12.0,39.0,2016.0,63038.0,811778176120668160,en,12556.0,Twitter for Android,"I met some really great Air Force GENERALS and Navy ADMIRALS today, talking about airplane capability and pricing. Very impressive people!"
,,21.0,13.0,12.0,29.0,2016.0,78839.0,811564284706689024,en,19538.0,Twitter for Android,I have not heard any of the pundits or commentators discussing the fact that I spent FAR LESS MONEY on the win than Hillary on the loss!
,,21.0,13.0,12.0,24.0,2016.0,51769.0,811562990285848576,en,11572.0,Twitter for Android,"I would have done even better in the election, if that is possible, if the winner was based on popular vote - but would campaign differently"
,,21.0,13.0,12.0,15.0,2016.0,65564.0,811560662853939200,en,15443.0,Twitter for Android,Campaigning to win the Electoral College is much more difficult &amp; sophisticated than the popular vote. Hillary focused on the wrong states!
,,20.0,20.0,12.0,27.0,2016.0,65512.0,811307169043849216,en,15072.0,Twitter for Android,"Yes, it is true - Carlos Slim, the great businessman from Mexico, called me about getting together for a meeting. We met, HE IS A GREAT GUY!"
,,20.0,13.0,12.0,9.0,2016.0,40414.0,811196778779463684,en,8584.0,Twitter for Android,"especially how to get people, even with an unlimited budget, out to vote in the vital swing states ( and more). They focused on wrong states"
,,20.0,13.0,12.0,3.0,2016.0,75570.0,811195441710764032,en,17939.0,Twitter for Android,"Bill Clinton stated that I called him after the election. Wrong, he called me (with a very nice congratulations). He ""doesn't know much"" ..."
,,20.0,2.0,12.0,50.0,2016.0,71030.0,811041034323054592,en,14844.0,Twitter for iPhone,"""@mike_pence: Congratulations to @RealDonaldTrump; officially elected President of the United States today by the Electoral College!"""
,,20.0,2.0,12.0,46.0,2016.0,47911.0,811039925571354624,en,10165.0,Twitter for iPhone,"""@Franklin_Graham: Congratulations to President-elect @realDonaldTrump--the electoral votes are in and it's official."" Thank you Franklin!"
,,20.0,1.0,12.0,31.0,2016.0,0.0,811021135483699201,und,8838.0,Twitter for iPhone,RT @DanScavino: #TrumpTrain🚂💨🇺🇸🇺🇸🇺🇸🇺🇸 https://t.co/qAQdBGEwSv
,,19.0,23.0,12.0,51.0,2016.0,214739.0,810996052241293312,en,56595.0,Twitter for Android,"We did it! Thank you to all of my great supporters, we just officially won the election (despite all of the distorted and inaccurate media)."
,,19.0,23.0,12.0,21.0,2016.0,108662.0,810988379051610112,en,37322.0,Twitter for Android,"Today there were terror attacks in Turkey, Switzerland and Germany - and it is only getting worse. The civilized world must change thinking!"
,,18.0,21.0,12.0,54.0,2016.0,129435.0,810604216771284992,en,34837.0,Twitter for Android,"If my many supporters acted and threatened people like those who lost the election are doing, they would be scorned &amp; called terrible names!"
,,18.0,0.0,12.0,59.0,2016.0,62589.0,810288321880555520,en,17187.0,Twitter for Android,We should tell China that we don't want the drone they stole back.- let them keep it!
,,18.0,0.0,12.0,12.0,2016.0,52798.0,810276411177107456,en,12551.0,Twitter for iPhone,"Thank you Alabama! From now on, it’s going to be #AmericaFirst. Our goal is to bring back that wonderful phrase:… https://t.co/4UAazd7TmF"
,,17.0,21.0,12.0,17.0,2016.0,0.0,810232514749075456,en,3646.0,Twitter for iPhone,"RT @DanScavino: Join President-elect Trump LIVE from Mobile, Alabama via his #Facebook page! #ThankYouTour2016 
Watch: https://t.co/btzN080…"
,,17.0,13.0,12.0,57.0,2016.0,58137.0,810121703288410112,en,18563.0,Twitter for iPhone,China steals United States Navy research drone in international waters - rips it out of water and takes it to China in unprecedented act.
,,17.0,13.0,12.0,20.0,2016.0,38557.0,810112407309844480,en,7935.0,Twitter for Android,"Mobile, Alabama today at 3:00 P.M. Last rally of the year - ""THANK YOU ALABAMA AND THE SOUTH"" Biggest of all crowds expected, see you there!"
,,17.0,13.0,12.0,7.0,2016.0,33676.0,810109131537481728,en,6875.0,Twitter for Android,"""@EazyMF_E: @realDonaldTrump Many people are now saying you will be an extremely successful president! #MakeAmericaGreatAgain""  Thank you!"
,,17.0,13.0,12.0,5.0,2016.0,34573.0,810108542921408512,en,6203.0,Twitter for Android,"Last night in Orlando, Florida, was incredible - massive crowd - THANK YOU FLORIDA! Today at 3:00 P.M. I will be in Alabama for last rally!"
,,17.0,3.0,12.0,52.0,2016.0,41644.0,809969373754654721,en,10713.0,Twitter for iPhone,Thank you Florida. My Administration will follow two simple rules: BUY AMERICAN and HIRE AMERICAN! #ICYMI- Watch:… https://t.co/3vgtzSJsFu
,,16.0,16.0,12.0,54.0,2016.0,26648.0,809803893920165892,en,6859.0,Twitter for iPhone,"#ThankYouTour2016 

Tonight- Orlando, Florida 
Tickets: https://t.co/JwQeccp79N

Tomorrow- Mobile, Alabama
Tickets:… https://t.co/Cq5AwcuzT9"
,,16.0,16.0,12.0,3.0,2016.0,67708.0,809790978332786689,en,17458.0,Twitter Web Client,"Well, we all did it, together! I hope the ""MOVEMENT"" fans will go to D.C. on Jan 20th for the swearing in. Let's set the all time record!"
,,16.0,11.0,12.0,9.0,2016.0,104316.0,809717035353722880,en,31952.0,Twitter for Android,Are we talking about the same cyberattack where it was revealed that head of the DNC illegally gave Hillary the questions to the debate?
,,16.0,1.0,12.0,32.0,2016.0,36592.0,809571983428120577,en,8612.0,Twitter for iPhone,"Thank you Pennsylvania! Together, we are going to MAKE AMERICA GREAT AGAIN! Watch here: https://t.co/7R382qWfWS… https://t.co/yB6u5FEfHq"
,,15.0,22.0,12.0,27.0,2016.0,21328.0,809525257371578369,en,5412.0,Twitter for iPhone,"Join me in Mobile, Alabama on Sat. at 3pm! #ThankYouTour2016 
Tickets: https://t.co/GGgbjl8Zo6 https://t.co/opKrWO4k0C"
,,15.0,14.0,12.0,24.0,2016.0,118663.0,809403760099422208,en,38828.0,Twitter for iPhone,"If Russia, or some other entity, was hacking, why did the White House wait so long to act? Why did they only complain after Hillary lost?"
,,15.0,13.0,12.0,28.0,2016.0,58089.0,809389774066814976,en,13225.0,Twitter for Android,"The media tries so hard to make my move to the White House, as it pertains to my business, so complex - when actually it isn't!"
