coordinates,created_at,created_d,created_h,created_m,created_min,created_y,favorite_count,id,lang,retweet_count,source,text
,,31.0,2.0,1.0,0.0,2018.0,61486.0,958520216429957121,en,14512.0,Twitter for iPhone,"Join me live for the #SOTU
https://t.co/0SLktWxfHi"
,,29.0,20.0,1.0,12.0,2018.0,71272.0,958070403901124609,en,14089.0,Twitter for iPhone,"Congratulations to America’s new Secretary of @HHSGov, Alex Azar! https://t.co/Y9inQaCt7o"
,,28.0,13.0,1.0,18.0,2018.0,184808.0,957603804383465472,en,39864.0,Twitter for iPhone,Our economy is better than it has been in many decades. Businesses are coming back to America like never before. Ch… https://t.co/ZrThpTutNr
,,28.0,13.0,1.0,18.0,2018.0,228135.0,957603800579297280,en,62346.0,Twitter for iPhone,"Somebody please inform Jay-Z that because of my policies, Black Unemployment has just been reported to be at the LOWEST RATE EVER RECORDED!"
,,28.0,4.0,1.0,8.0,2018.0,147047.0,957465263129219073,en,34330.0,Twitter for iPhone,Democrats are not interested in Border Safety &amp; Security or in the funding and rebuilding of our Military. They are… https://t.co/wM9cL8CBo7
,,28.0,3.0,1.0,58.0,2018.0,166805.0,957462746060206080,en,45864.0,Twitter for iPhone,"I have offered DACA a wonderful deal, including a doubling in the number of recipients &amp; a twelve year pathway to c… https://t.co/gSxSjiRcoC"
,,27.0,22.0,1.0,59.0,2018.0,108684.0,957387711693905925,en,21481.0,Twitter for iPhone,"Taliban targeted innocent Afghans, brave police in Kabul today. Our thoughts and prayers go to the victims, and fir… https://t.co/nxuDZV0VYZ"
,,27.0,19.0,1.0,30.0,2018.0,102007.0,957334999522533376,en,25185.0,Twitter for iPhone,"On Holocaust Remembrance Day we mourn and grieve the murder of 6 million innocent Jewish men, women and children, a… https://t.co/Df8jIU5KW2"
,,27.0,11.0,1.0,55.0,2018.0,120069.0,957220637705109505,en,28677.0,Twitter for iPhone,Thank you to Brandon Judd of the National Border Patrol Council for his strong statement on @foxandfriends that we… https://t.co/33QbAoLFxj
,,26.0,23.0,1.0,27.0,2018.0,69434.0,957032249509097472,en,16019.0,Twitter for iPhone,Thank you for the wonderful welcome @WEF! #Davos2018 https://t.co/IQkoQJxR5B
,,26.0,17.0,1.0,16.0,2018.0,116437.0,956938973326098432,en,26107.0,Twitter for iPhone,DACA has been made increasingly difficult by the fact that Cryin’ Chuck Schumer took such a beating over the shutdo… https://t.co/5faBeqcNP9
,,26.0,17.0,1.0,12.0,2018.0,109420.0,956937916374138880,en,22401.0,Twitter for iPhone,"Heading back from a very exciting two days in Davos, Switzerland. Speech on America’s economic revival was well rec… https://t.co/JbNNrNVH9z"
,,26.0,12.0,1.0,54.0,2018.0,49831.0,956873004776116225,en,9822.0,Twitter for iPhone,"Join me live at the 2018 World Economic Forum in Davos, Switzerland! #WEF18 https://t.co/fdHejCmv73 https://t.co/DuKJlVTWB8"
,,26.0,11.0,1.0,23.0,2018.0,53327.0,956849981528379392,en,10482.0,Twitter for iPhone,Great bilateral meeting with President @Alain_Berset of the Swiss Confederation - as we continue to strengthen our… https://t.co/3bK58PuFPd
,,26.0,10.0,1.0,46.0,2018.0,61276.0,956840839627595776,en,12212.0,Twitter for iPhone,"It was an honor to meet with Republic of Rwanda President Paul Kagame this morning in Davos, Switzerland. Many grea… https://t.co/tiD5NSYYwB"
,,26.0,10.0,1.0,11.0,2018.0,34575.0,956831942351183873,en,6347.0,Twitter for iPhone,"Will be interviewed on  @SquawkCNBC by @JoeSquawk coming up at 6:00amE from Davos, Switzerland. Enjoy! #WEF18 https://t.co/7egYlxnFBd"
,,25.0,22.0,1.0,38.0,2018.0,82286.0,956657520562573312,en,17603.0,Twitter for iPhone,"Today, Americans everywhere remember the brave men and women of @NASA who lost their lives in our Nation’s eternal… https://t.co/KMP2MhJVLS"
,,25.0,18.0,1.0,3.0,2018.0,71181.0,956588348864454656,en,15017.0,Twitter for iPhone,"Very productive bilateral meeting with Prime Minister Benjamin @Netanyahu of Israel - in Davos, Switzerland! #WEF18 https://t.co/2sZM9YI7tJ"
,,25.0,17.0,1.0,25.0,2018.0,74954.0,956578887160532992,en,15973.0,Twitter for iPhone,"Great bilateral meeting with Prime Minister Theresa May of the United Kingdom, affirming the special relationship a… https://t.co/6bIzOEo8DK"
,,25.0,0.0,1.0,27.0,2018.0,151732.0,956322473955545089,en,28503.0,Twitter for iPhone,"Will soon be heading to Davos, Switzerland, to tell the world how great America is and is doing. Our economy is now… https://t.co/OwSYSiCiKe"
,,24.0,22.0,1.0,51.0,2018.0,78066.0,956298399946563585,en,16737.0,Media Studio,It was my great honor to welcome Mayor’s from across America to the WH. My Administration will always support local… https://t.co/N7Z9Dw3uIi
,,24.0,20.0,1.0,26.0,2018.0,97637.0,956261892640604161,en,19279.0,Twitter for iPhone,"Earlier today, I spoke with @GovMattBevin of Kentucky regarding yesterday’s shooting at Marshall County High School… https://t.co/20Bf0p7oFT"
,,24.0,11.0,1.0,58.0,2018.0,146325.0,956134228726558720,en,33303.0,Twitter for iPhone,Tremendous investment by companies from all over the world being made in America. There has never been anything lik… https://t.co/sUp4LsbXhz
,,24.0,4.0,1.0,7.0,2018.0,154132.0,956015565776277510,en,36835.0,Twitter for iPhone,"Cryin’ Chuck Schumer fully understands, especially after his humiliating defeat, that if there is no Wall, there is… https://t.co/oaabUSfT9w"
,,24.0,3.0,1.0,54.0,2018.0,127136.0,956012274942128128,en,32403.0,Twitter for iPhone,"Where are the 50,000 important text messages between FBI lovers Lisa Page and Peter Strzok?  Blaming Samsung!"
,,23.0,14.0,1.0,16.0,2018.0,96893.0,955806333667807232,en,21593.0,Twitter for iPhone,"Thank you to General John Kelly, who is doing a fantastic job, and all of the Staff and others in the White House,… https://t.co/q4hhzEEjor"
,,23.0,13.0,1.0,34.0,2018.0,112037.0,955795912374267907,en,24151.0,Twitter for iPhone,"Nobody knows for sure that the Republicans &amp; Democrats will be able to reach a deal on DACA by February 8, but ever… https://t.co/2qBHLtCo1u"
,,23.0,11.0,1.0,55.0,2018.0,134608.0,955771016319590400,en,37243.0,Twitter for iPhone,"In one of the biggest stories in a long time, the FBI now says it is missing five months worth of lovers Strzok-Pag… https://t.co/Zwg2yDeEwz"
,,23.0,11.0,1.0,31.0,2018.0,128771.0,955764970590961665,en,27490.0,Twitter for iPhone,Even Crazy Jim Acosta of Fake News CNN agrees: “Trump World and WH sources dancing in end zone: Trump wins again...… https://t.co/X4ncbncUqi
,,23.0,4.0,1.0,30.0,2018.0,133075.0,955658992793149440,en,28218.0,Twitter for iPhone,"Big win for Republicans as Democrats cave on Shutdown. Now I want a big win for everyone, including Republicans, De… https://t.co/jzJKY5vaAz"
,,22.0,15.0,1.0,13.0,2018.0,92711.0,955458357200130049,en,21747.0,Twitter for iPhone,End the Democrats Obstruction! https://t.co/tzBXilvW1b
,,22.0,13.0,1.0,15.0,2018.0,109283.0,955428815777533952,en,22354.0,Twitter for iPhone,Democrats have shut down our government in the interests of their far left base. They don’t want to do it but are powerless!
,,22.0,13.0,1.0,7.0,2018.0,131752.0,955426609326100480,en,33434.0,Twitter for iPhone,The Democrats are turning down services and security for citizens in favor of services and security for non-citizens. Not good!
,,22.0,1.0,1.0,21.0,2018.0,126427.0,955249077645643776,en,23689.0,Twitter for iPhone,Thank you to Brad Blakeman on @FoxNews for grading year one of my presidency with an “A”-and likewise to Doug Schoe… https://t.co/RnE8Gh9xnh
,,21.0,12.0,1.0,35.0,2018.0,179038.0,955056249925750784,en,48089.0,Twitter for iPhone,Great to see how hard Republicans are fighting for our Military and Safety at the Border. The Dems just want illega… https://t.co/px3zwtzYOV
,,21.0,12.0,1.0,20.0,2018.0,0.0,955052436187701248,en,45017.0,Twitter for iPhone,RT @realDonaldTrump: Democrats are holding our Military hostage over their desire to have unchecked illegal immigration. Can’t let that hap…
,,21.0,2.0,1.0,34.0,2018.0,0.0,954905101717655552,en,14336.0,Twitter for iPhone,"RT @FoxNews: .@EricTrump: ""My father was elected for one reason, and that's because he actually believes in putting America first, which is…"
,,21.0,2.0,1.0,33.0,2018.0,0.0,954904669112995840,en,14511.0,Twitter for iPhone,"RT @FoxNews: .@KellyannePolls: ""Since @POTUS took office, 863,000 new jobs were filled by women. Over half a million American women have en…"
,,21.0,2.0,1.0,31.0,2018.0,0.0,954904246494916609,en,13166.0,Twitter for iPhone,"RT @FoxNews: .@davidwebbshow: ""Let's look at the calendar. It's January 20th. DACA expires on March 5th. That means this was a construct of…"
,,21.0,2.0,1.0,31.0,2018.0,0.0,954904160016785413,en,7332.0,Twitter for iPhone,"RT @FoxNews: .@EricTrump: ""People have seen a year that's incredible, that's been filled with nothing but the best for our country, America…"
,,21.0,2.0,1.0,18.0,2018.0,46268.0,954901073587834882,en,6347.0,Twitter for iPhone,Eric Trump on @JudgeJeanine on @FoxNews now!
,,21.0,0.0,1.0,47.0,2018.0,154503.0,954878124214415360,en,31938.0,Twitter for iPhone,"The Trump Administration has terminated more UNNECESSARY Regulation, in just twelve months, than any other Administ… https://t.co/SFS1cXtdx5"
,,21.0,0.0,1.0,40.0,2018.0,0.0,954876269300248576,en,42800.0,Twitter for iPhone,RT @realDonaldTrump: Democrats are far more concerned with Illegal Immigrants than they are with our great Military or Safety at our danger…
,,20.0,22.0,1.0,31.0,2018.0,130504.0,954843844402647040,en,29027.0,Twitter for iPhone,"Unprecedented success for our Country, in so many ways, since the Election. Record Stock Market, Strong on Military… https://t.co/S9Vev9LI6r"
,,20.0,18.0,1.0,51.0,2018.0,209610.0,954788467069870081,en,53993.0,Twitter for iPhone,"Beautiful weather all over our great country, a perfect day for all Women to March. Get out there now to celebrate… https://t.co/0mof82VUry"
,,20.0,14.0,1.0,27.0,2018.0,168776.0,954722155463430145,en,45017.0,Twitter for iPhone,Democrats are holding our Military hostage over their desire to have unchecked illegal immigration. Can’t let that happen!
,,20.0,11.0,1.0,47.0,2018.0,123459.0,954681839419101185,en,31856.0,Twitter for iPhone,#AMERICA FIRST!
,,20.0,11.0,1.0,44.0,2018.0,154816.0,954680914998648833,en,40262.0,Twitter for iPhone,"For those asking, the Republicans only have 51 votes in the Senate, and they need 60. That is why we need to win mo… https://t.co/VAQ4O1yYv5"
,,20.0,11.0,1.0,33.0,2018.0,124097.0,954678287820902401,en,30783.0,Twitter for iPhone,This is the One Year Anniversary of my Presidency and the Democrats wanted to give me a nice present. #DemocratShutdown
,,20.0,11.0,1.0,17.0,2018.0,145222.0,954674157144477696,en,42800.0,Twitter for iPhone,Democrats are far more concerned with Illegal Immigrants than they are with our great Military or Safety at our dan… https://t.co/eHAkBL3AjB
,,20.0,2.0,1.0,28.0,2018.0,117514.0,954541219970977793,en,31453.0,Twitter for iPhone,Not looking good for our great Military or Safety &amp; Security on the very dangerous Southern Border. Dems want a Shu… https://t.co/Zs62ydrvwQ
,,19.0,22.0,1.0,17.0,2018.0,64756.0,954478044487520257,en,13119.0,Twitter for iPhone,Excellent preliminary meeting in Oval with @SenSchumer - working on solutions for Security and our great Military t… https://t.co/EC7lpgkNxk
,,19.0,20.0,1.0,53.0,2018.0,128946.0,954456754137501697,en,28082.0,Twitter for iPhone,Just signed 702 Bill to reauthorize foreign intelligence collection. This is NOT the same FISA law that was so wron… https://t.co/20fZau7RFT
,,19.0,18.0,1.0,39.0,2018.0,96568.0,954423170299199488,en,25075.0,Twitter for iPhone,"Today, I was honored and proud to address the 45th Annual @March_for_Life! You are living witnesses of this year’s… https://t.co/eZL7D5NtYg"
,,19.0,16.0,1.0,28.0,2018.0,49515.0,954390114968498176,en,15636.0,Twitter for iPhone,"“Shutting down the government is a very serious thing. People die, accidents happen. I don’t know how I would vote… https://t.co/UdjOG3Ynvl"
,,19.0,16.0,1.0,14.0,2018.0,43881.0,954386490842378241,en,8552.0,Twitter for iPhone,".@WhiteHouse Briefing with Director Marc Short and Director Mick Mulvaney...
https://t.co/0O0VsYXmHB"
,,19.0,12.0,1.0,4.0,2018.0,110891.0,954323750949982208,en,26113.0,Twitter for iPhone,Government Funding Bill past last night in the House of Representatives. Now Democrats are needed if it is to pass… https://t.co/xK33TIW16o
,,18.0,23.0,1.0,39.0,2018.0,102012.0,954136290768846850,en,20431.0,Twitter for iPhone,House of Representatives needs to pass Government Funding Bill tonight. So important for our country - our Military needs it!
,,18.0,21.0,1.0,4.0,2018.0,103424.0,954097213608570880,en,26221.0,Twitter for iPhone,"AMERICA will once again be a NATION that thinks big, dreams bigger, and always reaches for the stars. YOU are the o… https://t.co/VYcBBrQ3pG"
,,18.0,20.0,1.0,45.0,2018.0,75919.0,954092417250222082,en,15296.0,Twitter for iPhone,"Departing Pittsburgh now, where it was my great honor to stand with our incredible workers, and to show the world t… https://t.co/hig8AOxDFs"
,,18.0,13.0,1.0,49.0,2018.0,90924.0,953987636057821184,en,21994.0,Twitter for iPhone,A government shutdown will be devastating to our military...something the Dems care very little about!
,,18.0,13.0,1.0,37.0,2018.0,62600.0,953984671674662912,en,12101.0,Twitter for iPhone,"CHIP should be part of a long term solution, not a 30 Day, or short term, extension!"
,,18.0,13.0,1.0,16.0,2018.0,124029.0,953979393180950528,en,29313.0,Twitter for iPhone,We need the Wall for the safety and security of our country. We need the Wall to help stop the massive inflow of dr… https://t.co/wlyEE41v2w
,,18.0,12.0,1.0,53.0,2018.0,85383.0,953973568035086336,en,17186.0,Twitter for iPhone,"Will be going to Pennsylvania today in order to give my total support to RICK SACCONE, running for Congress in a Sp… https://t.co/zPK4tKI6Vp"
,,18.0,11.0,1.0,25.0,2018.0,112345.0,953951365532876800,en,28260.0,Twitter for iPhone,"....The Wall will be paid for, directly or indirectly, or through longer term reimbursement, by Mexico, which has a… https://t.co/J09b17pLIi"
,,18.0,11.0,1.0,15.0,2018.0,94606.0,953948941674078208,en,21720.0,Twitter for iPhone,"The Wall is the Wall, it has never changed or evolved from the first day I conceived of it. Parts will be, of neces… https://t.co/3UJscR3WGL"
,,18.0,1.0,1.0,11.0,2018.0,179517.0,953796944564031489,en,40224.0,Twitter for iPhone,"ISIS is in retreat, our economy is booming, investments and jobs are pouring back into the country, and so much mor… https://t.co/pXV43doqxa"
,,18.0,1.0,1.0,5.0,2018.0,112495.0,953795518592843777,en,22536.0,Twitter for iPhone,"Despite some very corrupt and dishonest media coverage, there are many great reporters I respect and lots of GOOD N… https://t.co/XtmYEpRDAu"
,,18.0,1.0,1.0,0.0,2018.0,113419.0,953794085751574534,en,41986.0,Twitter for iPhone,"And the FAKE NEWS winners are...
https://t.co/59G6x2f7fD"
,,17.0,23.0,1.0,36.0,2018.0,68191.0,953773110553186312,en,15699.0,Twitter for iPhone,Main Street is BACK! Strongest Holiday Sales bump since the Great Recession -- beating forecasts by BILLIONS OF DOL… https://t.co/NzP72Zarmr
,,17.0,23.0,1.0,32.0,2018.0,99329.0,953772162665590787,en,24804.0,Twitter for iPhone,"During the campaign, I promised to MAKE AMERICA GREAT AGAIN by bringing businesses and jobs back to our country. I… https://t.co/OQ1fA6odh7"
,,17.0,23.0,1.0,28.0,2018.0,92542.0,953771038114045954,en,24563.0,Twitter for iPhone,I promised that my policies would allow companies like Apple to bring massive amounts of money back to the United S… https://t.co/aWutB2fro3
,,17.0,23.0,1.0,19.0,2018.0,75123.0,953768657221451776,en,15574.0,Media Studio,"Today, we witnessed an incredible moment in history – the presentation of Congress’ highest civilian honor to our f… https://t.co/svBhsLy1By"
,,17.0,13.0,1.0,4.0,2018.0,54521.0,953614071336701952,en,6767.0,Twitter for iPhone,Eric Trump on @foxandfriends  now!
,,16.0,23.0,1.0,20.0,2018.0,81942.0,953406553083777029,en,19213.0,Twitter for iPhone,"....we need to keep America safe, including moving away from a random chain migration and lottery system, to one th… https://t.co/wMQB8vJ3Cs"
,,16.0,23.0,1.0,19.0,2018.0,100375.0,953406423177859073,en,26016.0,Twitter for iPhone,New report from DOJ &amp; DHS shows that nearly 3 in 4 individuals convicted of terrorism-related charges are foreign-b… https://t.co/9F2yHphpOi
,,16.0,20.0,1.0,17.0,2018.0,56073.0,953360619834691585,en,10005.0,Twitter for iPhone,"Today, it was my honor to welcome President Nursultan Nazarbayev of Kazakhstan to the @WhiteHouse! https://t.co/TerYFZViax"
,,16.0,19.0,1.0,43.0,2018.0,74030.0,953352036309000194,en,19695.0,Twitter for iPhone,"“President Donald J. Trump Proclaims January 16, 2018, as Religious Freedom Day” https://t.co/bD3R2dJfyp"
,,16.0,14.0,1.0,30.0,2018.0,114100.0,953273134655987716,en,28489.0,Twitter for iPhone,Unemployment for Black Americans is the lowest ever recorded. Trump approval ratings with Black Americans has doubl… https://t.co/T5tmchLiz8
,,16.0,14.0,1.0,24.0,2018.0,73814.0,953271789790138368,en,16537.0,Twitter for iPhone,“90% of Trump 2017 news coverage was negative” -and much of it contrived!@foxandfriends
,,16.0,14.0,1.0,19.0,2018.0,111984.0,953270558573154305,en,26563.0,Twitter for iPhone,"Do you notice the Fake News Mainstream Media never likes covering the great and record setting economic news, but r… https://t.co/8kZJQ8SQZe"
,,16.0,14.0,1.0,7.0,2018.0,100647.0,953267506004754432,en,24049.0,Twitter for iPhone,The Democrats want to shut down the Government over Amnesty for all and Border Security. The biggest loser will be… https://t.co/Kv8aUAd3gD
,,16.0,13.0,1.0,54.0,2018.0,117800.0,953264081871495168,en,25169.0,Twitter for iPhone,"We must have Security at our VERY DANGEROUS SOUTHERN BORDER, and we must have a great WALL to help protect us, and… https://t.co/QH1uNnvCOq"
,,16.0,0.0,1.0,55.0,2018.0,0.0,953068179919638528,en,30513.0,Twitter for iPhone,RT @realDonaldTrump: Senator Dicky Durbin totally misrepresented what was said at the DACA meeting. Deals can’t get made when there is no t…
,,16.0,0.0,1.0,53.0,2018.0,0.0,953067686313037829,en,27921.0,Twitter for iPhone,"RT @realDonaldTrump: DACA is probably dead because the Democrats don’t really want it, they just want to talk and take desperately needed m…"
,,16.0,0.0,1.0,53.0,2018.0,0.0,953067606612828161,en,39843.0,Twitter for iPhone,"RT @realDonaldTrump: I, as President, want people coming into our Country who are going to help us become strong and great again, people co…"
,,16.0,0.0,1.0,52.0,2018.0,0.0,953067477830946816,en,19293.0,Twitter for iPhone,RT @realDonaldTrump: ...big unnecessary regulation cuts made it all possible” (among many other things). “President Trump reversed the poli…
,,16.0,0.0,1.0,52.0,2018.0,0.0,953067456255406081,en,25228.0,Twitter for iPhone,"RT @realDonaldTrump: “President Trump is not getting the credit he deserves for the economy. Tax Cut bonuses to more than 2,000,000 workers…"
,,16.0,0.0,1.0,50.0,2018.0,0.0,953066854079135744,en,13882.0,Twitter for iPhone,"RT @EricTrump: I will be always be incredibly proud of my work for @StJude, raising $16.3+ million dollars over the last 10 years at a 9.2%…"
,,16.0,0.0,1.0,48.0,2018.0,0.0,953066286434652165,und,8884.0,Twitter for iPhone,RT @EricTrump: #MakeAmericaGreatAgain 🇺🇸🇺🇸🇺🇸 https://t.co/b81NtQGhHa
,,16.0,0.0,1.0,47.0,2018.0,0.0,953066265987420160,en,2648.0,Twitter for iPhone,"RT @Heritage: We had a special visitor yesterday. @IvankaTrump, thank you for meeting with @KayColesJames, spending time with our team, and…"
,,15.0,20.0,1.0,28.0,2018.0,118254.0,953000902331453442,en,30513.0,Twitter for iPhone,Senator Dicky Durbin totally misrepresented what was said at the DACA meeting. Deals can’t get made when there is n… https://t.co/YaPbD8cjHe
,,15.0,16.0,1.0,1.0,2018.0,0.0,952933691642339329,en,21577.0,Twitter for iPhone,"RT @WhiteHouse: ""Dr. King's dream is our dream. It is the American Dream. It's the promise stitched into the fabric of our Nation, etched i…"
,,15.0,13.0,1.0,2.0,2018.0,113500.0,952888691944550401,en,23731.0,Twitter for iPhone,"...to stop drugs, they want to take money away from our military which we cannot do.” My standard is very simple, A… https://t.co/Q3BJnCHTLv"
,,15.0,12.0,1.0,57.0,2018.0,94724.0,952887520790040576,en,22284.0,Twitter for iPhone,"Statement by me last night in Florida: “Honestly, I don’t think the Democrats want to make a deal. They talk about… https://t.co/L3CS8EO9D9"
,,14.0,13.0,1.0,59.0,2018.0,88761.0,952540700683497472,en,19293.0,Twitter for iPhone,...big unnecessary regulation cuts made it all possible” (among many other things). “President Trump reversed the p… https://t.co/wnLrQrTsWp
,,14.0,13.0,1.0,50.0,2018.0,112404.0,952538350333939713,en,25228.0,Twitter for iPhone,"“President Trump is not getting the credit he deserves for the economy. Tax Cut bonuses to more than 2,000,000 work… https://t.co/0US33d7EuY"
,,14.0,13.0,1.0,19.0,2018.0,162051.0,952530515894169601,en,39843.0,Twitter for iPhone,"I, as President, want people coming into our Country who are going to help us become strong and great again, people… https://t.co/IkpH8hauTL"
,,14.0,13.0,1.0,9.0,2018.0,122522.0,952528011869478912,en,27921.0,Twitter for iPhone,"DACA is probably dead because the Democrats don’t really want it, they just want to talk and take desperately neede… https://t.co/gZRLa3KopW"
,,14.0,13.0,1.0,4.0,2018.0,0.0,952526791658360833,en,34704.0,Twitter for iPhone,"RT @realDonaldTrump: So much Fake News is being reported. They don’t even try to get it right, or correct it when they are wrong. They prom…"
,,14.0,13.0,1.0,1.0,2018.0,83623.0,952526145064505345,en,16640.0,Twitter for iPhone,...and they knew exactly what I said and meant. They just wanted a story. FAKE NEWS!
,,14.0,12.0,1.0,58.0,2018.0,96336.0,952525384242876416,en,22624.0,Twitter for iPhone,The Wall Street Journal stated falsely that I said to them “I have a good relationship with Kim Jong Un” (of N. Kor… https://t.co/ZvyN9rhbFn
,,14.0,3.0,1.0,50.0,2018.0,0.0,952387373056380928,und,15846.0,Twitter for iPhone,RT @paulsperry_: https://t.co/aU1rdyKA1W
,,14.0,3.0,1.0,49.0,2018.0,0.0,952387277610774528,en,10409.0,Twitter for iPhone,"RT @paulsperry_: Fusion GPS, firm behind disputed Russia dossier, retracts its claim of FBI mole in Trump camp
https://t.co/s6CFPXSVqb"
,,14.0,3.0,1.0,45.0,2018.0,0.0,952386227705204736,en,23403.0,Twitter for iPhone,"RT @JackPosobiec: Dick Durbin called Trump racist for wanting to end chain migration. 

Here's a video of Dick Durbin calling for an end to…"
,,14.0,3.0,1.0,42.0,2018.0,0.0,952385311669178368,en,18302.0,Twitter for iPhone,RT @LouDobbs: The stock market has gained an incredible 7.8 Trillion dollars in market value since @POTUS was elected! Looks like 4% econom…
,,13.0,22.0,1.0,8.0,2018.0,148186.0,952301373479104512,en,34704.0,Twitter for iPhone,"So much Fake News is being reported. They don’t even try to get it right, or correct it when they are wrong. They p… https://t.co/O5Mqd6avqH"
,,13.0,14.0,1.0,20.0,2018.0,124703.0,952183458922672130,en,27289.0,Twitter for iPhone,I don’t believe the Democrats really want to see a deal on DACA. They are all talk and no action. This is the time… https://t.co/K5o4njHvXx
,,13.0,13.0,1.0,14.0,2018.0,152841.0,952166927476183040,en,37536.0,Twitter for iPhone,AMERICA FIRST!
,,13.0,13.0,1.0,14.0,2018.0,104395.0,952166857670320128,en,21867.0,Twitter for iPhone,The Democrats are all talk and no action. They are doing nothing to fix DACA. Great opportunity missed. Too bad!
,,13.0,13.0,1.0,13.0,2018.0,117865.0,952166643202916352,en,24541.0,Twitter for iPhone,"Yesterday was a big day for the stock market. Jobs are coming back to America. Chrysler is coming back to the USA,… https://t.co/0BKC8RejRA"
,,12.0,17.0,1.0,56.0,2018.0,109267.0,951875499537641472,en,26462.0,Twitter for iPhone,"Today, it was my great honor to proclaim January 15, 2018, as Martin Luther King Jr., Federal Holiday. I encourage… https://t.co/HMoyGfAZLJ"
,,12.0,13.0,1.0,48.0,2018.0,138718.0,951813216291708928,en,36445.0,Twitter for iPhone,"Never said anything derogatory about Haitians other than Haiti is, obviously, a very poor and troubled country. Nev… https://t.co/HivKR2wF8g"
,,12.0,12.0,1.0,50.0,2018.0,124966.0,951798415301718017,en,32013.0,Twitter for iPhone,"Sadly, Democrats want to stop paying our troops and government workers in order to give a sweetheart deal, not a fa… https://t.co/jivCaE5vpb"
,,12.0,12.0,1.0,28.0,2018.0,103612.0,951793123985973248,en,24690.0,Twitter for iPhone,"The language used by me at the DACA meeting was tough, but this was not the language used. What was really tough wa… https://t.co/8PvNzf41G4"
,,12.0,12.0,1.0,20.0,2018.0,92145.0,951790999784783872,en,22958.0,Twitter for iPhone,"....Because of the Democrats not being interested in life and safety, DACA has now taken a big step backwards. The… https://t.co/YzEuBuYGrs"
,,12.0,12.0,1.0,9.0,2018.0,110168.0,951788342647107584,en,24387.0,Twitter for iPhone,....countries which are doing badly. I want a merit based system of immigration and people who will help take our c… https://t.co/QfbeeEN6qP
,,12.0,11.0,1.0,59.0,2018.0,83959.0,951785587765280768,en,21677.0,Twitter for iPhone,The so-called bipartisan DACA deal presented yesterday to myself and a group of Republican Senators and Congressmen… https://t.co/5s50JXBumv
,,12.0,4.0,1.0,57.0,2018.0,125085.0,951679619341737986,en,29864.0,Twitter for iPhone,Reason I canceled my trip to London is that I am not a big fan of the Obama Administration having sold perhaps the… https://t.co/9crSrOBXme
