coordinates,created_at,created_d,created_h,created_m,created_min,created_y,favorite_count,id,lang,retweet_count,source,text
,,21.0,2.0,6.0,41.0,2017.0,115715.0,877355739383287808,en,24531.0,Twitter for iPhone,"Congratulations to Karen Handel on her big win in Georgia 6th. Fantastic job, we are all very proud of you!"
,,21.0,2.0,6.0,33.0,2017.0,88953.0,877353797760286720,en,18071.0,Twitter for iPhone,"Thank you @FoxNews ""Huge win for President Trump and GOP in Georgia Congressional Special Election."""
,,21.0,2.0,6.0,21.0,2017.0,67751.0,877350761742688256,en,9891.0,Twitter for iPhone,Things are looking great for Karen H!
,,21.0,1.0,6.0,42.0,2017.0,46024.0,877341043171241984,en,8944.0,Twitter for iPhone,"It was a great honor to welcome President Petro Poroshenko of Ukraine to the @WhiteHouse today with @VP Pence.
➡️… https://t.co/J1ulOd6pYQ"
,,20.0,18.0,6.0,38.0,2017.0,80412.0,877234140483121152,en,17865.0,Twitter for iPhone,"While I greatly appreciate the efforts of President Xi &amp; China to help with North Korea, it has not worked out. At least I know China tried!"
,,20.0,16.0,6.0,41.0,2017.0,61824.0,877204691851108353,en,14270.0,Twitter for iPhone,The U.S. once again condemns the brutality of the North Korean regime as we mourn its latest victim. Video: https://t.co/Rvm11ZbPk7
,,20.0,10.0,6.0,2.0,2017.0,79572.0,877104262463008771,en,20804.0,Twitter for iPhone,"KAREN HANDEL FOR CONGRESS. She will fight for lower taxes, great healthcare strong security-a hard worker who will never give up! VOTE TODAY"
,,20.0,9.0,6.0,52.0,2017.0,0.0,877101828143542272,en,11658.0,Twitter for iPhone,"RT @SheriffClarke: Happy Father's Day to all dads. My dad. Like father, like son, @realDonaldTrump supporters to the end. He an Airborne Ra…"
,,20.0,9.0,6.0,49.0,2017.0,68235.0,877101173412638720,en,18788.0,Twitter for iPhone,"Democrat Jon Ossoff, who wants to raise your taxes to the highest level and is weak on crime and security, doesn't even live in district."
,,20.0,0.0,6.0,45.0,2017.0,79666.0,876964061027684352,en,20244.0,Twitter for iPhone,"Big day tomorrow in Georgia and South Carolina. ObamaCare is dead. Dems want to raise taxes big! They can only obstruct, no ideas. Vote ""R"""
,,19.0,23.0,6.0,57.0,2017.0,0.0,876952186143506432,en,5860.0,Twitter for iPhone,RT @joegooding: What's happening in our country isn't just an assault on our @POTUS @realDonaldTrump it's an assault on the American people…
,,19.0,23.0,6.0,56.0,2017.0,0.0,876951845880688644,en,8551.0,Twitter for iPhone,"RT @FoxNews: New Poll Shows @POTUS Approval at 50 Percent
https://t.co/FRWlSVvxzQ"
,,19.0,23.0,6.0,44.0,2017.0,68608.0,876948721468141573,en,16887.0,Twitter for iPhone,Melania and I offer our deepest condolences to the family of Otto Warmbier. Full statement: https://t.co/8kmcA6YtFD https://t.co/EhrP4BiJeB
,,19.0,21.0,6.0,53.0,2017.0,37839.0,876921011668738050,en,6971.0,Twitter for iPhone,"It was my great honor to welcome President @JC_Varela &amp; Mrs. Varela from Panama this afternoon.🇺🇸🇵🇦
➡️… https://t.co/770OJj2uYb"
,,19.0,20.0,6.0,35.0,2017.0,42325.0,876901304207069185,en,10471.0,Twitter for iPhone,"....because he doesn't even live there! He wants to raise taxes and kill healthcare. On Tuesday, #VoteKarenHandel."
,,19.0,20.0,6.0,34.0,2017.0,54410.0,876900944444837890,en,16286.0,Twitter for iPhone,Karen Handel's opponent in #GA06 can't even vote in the district he wants to represent....
,,19.0,20.0,6.0,27.0,2017.0,39076.0,876899250071904256,en,8058.0,Twitter for iPhone,....getting great border security and healthcare. #VoteRalphNorman tomorrow!
,,19.0,20.0,6.0,27.0,2017.0,51907.0,876899176562524160,en,12735.0,Twitter for iPhone,"Ralph Norman, who is running for Congress in SC's 5th District, will be a fantastic help to me in cutting taxes, and...."
,,19.0,20.0,6.0,15.0,2017.0,54455.0,876896144944762880,en,12196.0,Twitter for iPhone,My heartfelt thoughts and prayers are with the 7 @USNavy sailors of the #USSFitzgerald and their families. ➡️… https://t.co/L3u5c8Iymh
,,19.0,12.0,6.0,27.0,2017.0,82386.0,876778344636928000,en,22448.0,Twitter for iPhone,"The Dems want to stop tax cuts, good healthcare and Border Security.Their ObamaCare is dead with 100% increases in P's. Vote now for Karen H"
,,18.0,21.0,6.0,52.0,2017.0,0.0,876558248631042049,en,7846.0,Twitter for iPhone,RT @WhiteHouse: Happy Father's Day! https://t.co/32tFoVa4Ov
,,18.0,21.0,6.0,51.0,2017.0,105651.0,876558049565188096,en,17640.0,Twitter for iPhone,Camp David is a very special place. An honor to have spent the weekend there. Military runs it so well and are so proud of what they do!
,,18.0,21.0,6.0,28.0,2017.0,0.0,876552203187736577,en,17601.0,Twitter for iPhone,"RT @DonaldJTrumpJr: Not surprising at all! 
Father Of Otto Warmbier: Obama Admin Told Us To Keep Quiet, Trump Admin Brought Him Home  https…"
,,18.0,21.0,6.0,7.0,2017.0,0.0,876546864669237253,en,14156.0,Twitter for iPhone,"RT @DiamondandSilk: The Media Says:  The President Should Stop Tweeting about Russia. 
 Well, Why Don't the Media Take Their Own Advice &amp; S…"
,,18.0,11.0,6.0,2.0,2017.0,101492.0,876394578777174021,en,22568.0,Twitter for iPhone,"The new Rasmussen Poll, one of the most accurate in the 2016 Election, just out with a Trump 50% Approval Rating.That's higher than O's #'s!"
,,18.0,10.0,6.0,46.0,2017.0,86483.0,876390681056600066,en,17626.0,Twitter for iPhone,"...massive regulation cuts, 36 new legislative bills signed, great new S.C.Justice, and Infrastructure, Healthcare and Tax Cuts in works!"
,,18.0,10.0,6.0,38.0,2017.0,99090.0,876388733607694336,en,20761.0,Twitter for iPhone,"The MAKE AMERICA GREAT AGAIN agenda is doing very well despite the distraction of the Witch Hunt. Many new jobs, high business enthusiasm,.."
,,17.0,14.0,6.0,8.0,2017.0,83323.0,876079184417882116,en,19799.0,Twitter for iPhone,Thoughts and prayers with the sailors of USS Fitzgerald and their families. Thank you to our Japanese allies for th… https://t.co/BBvmTFxVkk
,,17.0,1.0,6.0,31.0,2017.0,0.0,875888479942651909,en,5641.0,Twitter for iPhone,RT @seanhannity: #Hannity Starts in 30 minutes with @newtgingrich and my monologue on the Deep State’s allies in the media
,,17.0,1.0,6.0,30.0,2017.0,102220.0,875888258407858176,en,20589.0,Twitter for iPhone,Back from Miami where my Cuban/American friends are very happy with what I signed today. Another campaign promise that I did not forget!
,,16.0,22.0,6.0,32.0,2017.0,42838.0,875843513761583104,en,9188.0,Twitter for iPhone,"""National Security Presidential Memorandum on Strengthening the Policy of the United States Toward Cuba""
Memorandum… https://t.co/RVr9Dg2hXt"
,,16.0,22.0,6.0,18.0,2017.0,45065.0,875840132238032897,en,10302.0,Media Studio,"""Remarks by President Trump on the Policy of the U.S.A. Towards Cuba""
Video: https://t.co/jUWCjgxX5D
Transcript:… https://t.co/hILCHbPJet"
,,16.0,15.0,6.0,12.0,2017.0,70738.0,875732813278048256,en,17686.0,Twitter for iPhone,Great news! #MAGA https://t.co/pirHR7lAyT
,,16.0,13.0,6.0,7.0,2017.0,149993.0,875701471999864833,en,47710.0,Twitter for iPhone,I am being investigated for firing the FBI Director by the man who told me to fire the FBI Director! Witch Hunt
,,16.0,12.0,6.0,54.0,2017.0,109577.0,875698062030778368,en,24218.0,Twitter for iPhone,"Despite the phony Witch Hunt going on in America, the economic &amp; jobs numbers are great. Regulations way down, jobs and enthusiasm way up!"
,,16.0,12.0,6.0,23.0,2017.0,131328.0,875690204564258816,en,28245.0,Twitter for iPhone,The Fake News Media hates when I use what has turned out to be my very powerful Social Media - over 100 million people! I can go around them
,,16.0,11.0,6.0,53.0,2017.0,107073.0,875682853585129472,en,24896.0,Twitter for iPhone,"After 7 months of investigations &amp; committee hearings about my ""collusion with the Russians,""  nobody has been able to show any proof. Sad!"
,,15.0,23.0,6.0,49.0,2017.0,73417.0,875500520840060928,und,16654.0,Media Studio,#CongressionalBaseballGame⚾️ https://t.co/u8InOJTf6D
,,15.0,21.0,6.0,43.0,2017.0,48068.0,875468769212149760,en,9242.0,Twitter Web Client,"Thank you Wisconsin! Tuesday was a great success for #WorkforceWeek at @WCTC w/ @IvankaTrump &amp; @GovWalker. 
Remarks… https://t.co/L8o396yYKX"
,,15.0,19.0,6.0,56.0,2017.0,149451.0,875441788110110727,en,52957.0,Twitter for iPhone,"Crooked H destroyed phones w/ hammer, 'bleached' emails, &amp; had husband meet w/AG days before she was cleared- &amp; they talk about obstruction?"
,,15.0,19.0,6.0,43.0,2017.0,120924.0,875438639823675392,en,35742.0,Twitter for iPhone,"Why is that Hillary Clintons family and Dems dealings with Russia are not looked at, but my non-dealings are?"
,,15.0,11.0,6.0,57.0,2017.0,118553.0,875321478849363968,en,34931.0,Twitter for iPhone,You are witnessing the single greatest WITCH HUNT in American political history - led by some very bad and conflicted people!  #MAGA
,,15.0,10.0,6.0,55.0,2017.0,139415.0,875305788708974592,en,40745.0,Twitter for iPhone,"They made up a phony collusion with the Russians story, found zero proof, so now they go for obstruction of justice on the phony story. Nice"
,,15.0,1.0,6.0,41.0,2017.0,189970.0,875166406417010688,en,40082.0,Twitter for iPhone,"Just left hospital. Rep. Steve Scalise, one of the truly great people, is in very tough shape - but he is a real fighter. Pray for Steve!"
,,14.0,14.0,6.0,7.0,2017.0,140448.0,874991696186142721,en,29229.0,Twitter for iPhone,"Happy birthday to U.S. ARMY and our soldiers. Thank you for your bravery, sacrifices, &amp; dedication. Proud to be your Commander-in-Chief!"
,,14.0,12.0,6.0,48.0,2017.0,138035.0,874971795362897921,en,32082.0,Twitter for iPhone,"Rep. Steve Scalise of Louisiana, a true friend and patriot, was badly injured but will fully recover. Our thoughts and prayers are with him."
,,14.0,2.0,6.0,53.0,2017.0,83321.0,874822136782880768,en,11601.0,Twitter for iPhone,"Just got back from Wisconsin. Great day, great people!"
,,14.0,2.0,6.0,50.0,2017.0,0.0,874821262987730944,en,6770.0,Twitter for iPhone,RT @TuckerCarlson: .@RichardGrenell : @realDonaldTrump told Tillerson he had the full support of the U.S. Gov't to bring #OttoWarmbier home…
,,13.0,23.0,6.0,18.0,2017.0,56386.0,874767922295705600,en,13632.0,Twitter for iPhone,The passage of the @DeptVetAffairs Accountability and Whistleblower Protection Act is GREAT news for veterans! I lo… https://t.co/k45aci25BT
,,13.0,20.0,6.0,41.0,2017.0,65368.0,874728484475744257,en,12379.0,Twitter for iPhone,"Just arrived in Wisconsin to discuss JOBS, JOBS, JOBS! #MAGA🇺🇸 https://t.co/lEJ9S817yb"
,,13.0,13.0,6.0,56.0,2017.0,80952.0,874626492310978564,en,20902.0,Twitter for iPhone,"2 million more people just dropped out of ObamaCare. It is in a death spiral. Obstructionist Democrats gave up, have no answer = resist!"
,,13.0,13.0,6.0,29.0,2017.0,66537.0,874619861019840512,en,12809.0,Twitter for iPhone,"Heading to the Great State of Wisconsin to talk about JOBS, JOBS, JOBS! Big progress being made as the Real News is reporting."
,,13.0,12.0,6.0,48.0,2017.0,92691.0,874609480301936640,en,22550.0,Twitter for iPhone,Fake News is at an all time high. Where is their apology to me for all of the incorrect stories???
,,13.0,12.0,6.0,45.0,2017.0,92359.0,874608587473080320,en,28120.0,Twitter for iPhone,A.G. Lynch made law enforcement decisions for political purposes...gave Hillary Clinton a free pass and protection. Totally illegal!
,,13.0,12.0,6.0,7.0,2017.0,0.0,874599130018054145,en,18140.0,Twitter for iPhone,RT @Corrynmb: @realDonaldTrump Liberals have an agenda and it's not in America's best interest. Keep fighting the good fight! We stand with…
,,13.0,10.0,6.0,44.0,2017.0,64859.0,874578159676665857,en,16622.0,Twitter for iPhone,"Well, as predicted, the 9th Circuit did it again - Ruled against the TRAVEL BAN at such a dangerous time in the history of our country. S.C."
,,13.0,10.0,6.0,35.0,2017.0,94108.0,874576057579565056,en,24412.0,Twitter for iPhone,The Fake News Media has never been so wrong or so dirty. Purposely incorrect stories and phony sources to meet their agenda of hate. Sad!
,,13.0,0.0,6.0,9.0,2017.0,45467.0,874418514240688129,en,9554.0,Twitter Web Client,"Congratulations to the 2016 @ClemsonFB Tigers!
Full ceremony: https://t.co/syJUGoMhHJ
#NationalChampions🏈 https://t.co/F23NZoX2BI"
,,12.0,21.0,6.0,10.0,2017.0,72695.0,874373283919089664,en,16210.0,Twitter Ads,"Finally held our first full @Cabinet meeting today. With this great team, we can restore American prosperity and br… https://t.co/b0roksHTFE"
,,12.0,17.0,6.0,59.0,2017.0,68243.0,874325287143604224,en,16580.0,Twitter for iPhone,"Congratulations! 

'First New Coal Mine of Trump Era Opens in Pennsylvania' https://t.co/aIRllxNLQA"
,,12.0,16.0,6.0,58.0,2017.0,87595.0,874309930232184833,en,22055.0,Twitter for iPhone,We will NEVER FORGET the victims who lost their lives one year ago today in the horrific #PulseNightClub shooting.… https://t.co/7lZGgDJkxZ
,,12.0,10.0,6.0,55.0,2017.0,44211.0,874218586155479040,en,4933.0,Twitter for iPhone,Ivanka on @foxandfriends now!
,,12.0,2.0,6.0,14.0,2017.0,86742.0,874087477807599616,en,18679.0,Twitter for iPhone,"Great numbers on the economy. All of our work, including the passage of many bills &amp; regulation killing Executive Orders, now kicking in!"
,,12.0,2.0,6.0,9.0,2017.0,0.0,874086142425083904,en,7591.0,Twitter for iPhone,RT @foxandfriends: .@GeraldoRivera: Chances of impeachment went from 3% to 0% with Comey's testimony https://t.co/kfeXKdpJGe
,,12.0,2.0,6.0,7.0,2017.0,0.0,874085723762286592,en,5651.0,Twitter for iPhone,"RT @foxandfriends: ""Yesterday's hearings provided zero evidence of collusion between our campaign and the Russians because there wasn't any…"
,,12.0,2.0,6.0,2.0,2017.0,58287.0,874084433460154368,en,8418.0,Twitter for iPhone,"My daughter, Ivanka, will be on @foxandfriends tomorrow morning. Enjoy!"
,,11.0,12.0,6.0,49.0,2017.0,108226.0,873884774041079808,en,29898.0,Twitter for iPhone,"The Democrats have no message,  not on economics, not on taxes,  not on jobs, not on failing #Obamacare. They are only OBSTRUCTIONISTS!"
,,11.0,12.0,6.0,29.0,2017.0,93463.0,873879934040780801,en,24068.0,Twitter for iPhone,I believe the James Comey leaks will be far more prevalent than anyone ever thought possible. Totally illegal? Very 'cowardly!'
,,11.0,12.0,6.0,23.0,2017.0,86409.0,873878232264822784,en,18542.0,Twitter for iPhone,"...way up. Regulations way down. 600,000+ new jobs added. Unemployment down to 4.3%. Business and economic enthusiasm way up- record levels!"
,,11.0,12.0,6.0,22.0,2017.0,96684.0,873878061778907137,en,23791.0,Twitter for iPhone,The #FakeNews MSM doesn't report the great economic news since Election Day. #DOW up 16%. #NASDAQ up 19.5%. Drilling &amp; energy sector...
,,10.0,20.0,6.0,52.0,2017.0,77990.0,873643935993708544,en,19355.0,Twitter Ads,America is going to build again. Under budget and ahead of schedule. Time to put #AmericaFirst! #InfrastructureWeek… https://t.co/D5TbbjXcN3
,,10.0,1.0,6.0,38.0,2017.0,91904.0,873353586025132038,en,21343.0,Twitter Ads,"Time to start building in our country, with American workers &amp; with American iron, aluminum &amp; steel. It is time to… https://t.co/rGZCRyeCMZ"
,,9.0,22.0,6.0,52.0,2017.0,89706.0,873311842956914688,en,21331.0,Twitter Web Client,"It is time to rebuild OUR country, to bring back OUR jobs, to restore OUR dreams, &amp; yes, to put #AmericaFirst! TY O… https://t.co/2b2bXwxGkA"
,,9.0,18.0,6.0,48.0,2017.0,58672.0,873250570508922880,en,12047.0,Twitter Web Client,A great honor to host and welcome leaders from around America to the @WhiteHouse Infrastructure Summit.… https://t.co/5f6cN3HboQ
,,9.0,18.0,6.0,28.0,2017.0,59255.0,873245481488535554,en,14834.0,Twitter Web Client,"An honor to join the @FaithandFreedom Coalition yesterday. In America, we don't worship government. We worship God.… https://t.co/1ds8BrzUQe"
,,9.0,14.0,6.0,22.0,2017.0,78081.0,873183401620230144,en,16637.0,Twitter for iPhone,Congratulations to Jeb Hensarling &amp; Republicans on successful House vote to repeal major parts of the 2010 Dodd-Frank financial law. GROWTH!
,,9.0,14.0,6.0,10.0,2017.0,0.0,873180518493429765,en,14307.0,Twitter for iPhone,RT @AlanDersh: We should stop talking about obstruction of justice. No plausible case. We must distinguish crimes from pol sins https://t.c…
,,9.0,10.0,6.0,54.0,2017.0,83504.0,873131235614347264,en,14310.0,Twitter for iPhone,Great reporting by @foxandfriends and so many others. Thank you!
,,9.0,10.0,6.0,10.0,2017.0,122669.0,873120139222306817,en,35983.0,Twitter for iPhone,"Despite so many false statements and lies, total and complete vindication...and WOW, Comey is a leaker!"
,,7.0,12.0,6.0,17.0,2017.0,88062.0,872427222392504320,en,16640.0,Twitter for iPhone,"Getting ready to leave for Cincinnati, in the GREAT STATE of OHIO, to meet with ObamaCare victims and talk Healthcare &amp; also Infrastructure!"
,,7.0,11.0,6.0,44.0,2017.0,94899.0,872419018799550464,en,23773.0,Twitter for iPhone,"I will be nominating Christopher A. Wray, a man of impeccable credentials, to be the new Director of the FBI. Details to follow."
,,7.0,1.0,6.0,7.0,2017.0,101258.0,872258719404482561,en,24172.0,Twitter for iPhone,Senate passed the VA Accountability Act. The House should get this bill to my desk ASAP! We can’t tolerate substandard care for our vets.
,,7.0,0.0,6.0,44.0,2017.0,40762.0,872253002266161153,en,7475.0,Twitter for iPhone,"#ICYMI: Announcement of Air Traffic Control Initiative 

Watch➡️https://t.co/IMiZr22gAw"
,,7.0,0.0,6.0,6.0,2017.0,43853.0,872243414930264065,en,8974.0,Twitter Ads,"Great meeting with @HouseGOP and @SenateGOP leaders, including @SpeakerRyan, @SenateMajLdr, @GOPLeader, @JohnCornyn… https://t.co/G03W8CEtCS"
,,6.0,17.0,6.0,47.0,2017.0,98071.0,872147965451882496,en,26238.0,Twitter for iPhone,Today we remember the courage and bravery of our troops that stormed the beaches of Normandy 73 years ago. #DDay… https://t.co/zhR24dMzYB
,,6.0,13.0,6.0,44.0,2017.0,67738.0,872086906804240384,en,42619.0,Twitter for iPhone,"...extremism, and all reference was pointing to Qatar. Perhaps this will be the beginning of the end to the horror of terrorism!"
,,6.0,13.0,6.0,36.0,2017.0,66172.0,872084870620520448,en,40337.0,Twitter for iPhone,So good to see the Saudi Arabia visit with the King and 50 countries already paying off. They said they would take a hard line on funding...
,,6.0,12.0,6.0,15.0,2017.0,104757.0,872064426568036353,en,25704.0,Twitter for iPhone,"Sorry folks, but if I would have relied on the Fake News of CNN, NBC, ABC, CBS, washpost or nytimes, I would have had ZERO chance winning WH"
,,6.0,12.0,6.0,6.0,2017.0,76163.0,872062159789985792,en,84431.0,Twitter for iPhone,During my recent trip to the Middle East I stated that there can no longer be funding of Radical Ideology. Leaders pointed to Qatar - look!
,,6.0,11.0,6.0,58.0,2017.0,110142.0,872059997429022722,en,27279.0,Twitter for iPhone,The FAKE MSM is working so hard trying to get me not to use Social Media. They hate that I can get the honest and unfiltered message out.
,,6.0,10.0,6.0,51.0,2017.0,70274.0,872043300949295104,en,12641.0,Twitter for iPhone,Big meeting today with Republican leadership concerning Tax Cuts and Healthcare. We are all pushing hard - must get it right!
,,6.0,10.0,6.0,43.0,2017.0,0.0,872041195618349056,en,8263.0,Twitter for iPhone,"RT @foxandfriends: FOX NEWS ALERT: ISIS claims responsibility for hostage siege in Melbourne, Australia that killed 1 person and injured 3…"
,,6.0,10.0,6.0,41.0,2017.0,0.0,872040726120550404,en,6803.0,Twitter for iPhone,RT @foxandfriends: Sen. Ted Cruz: Trump's air traffic control plan is a 'win-win' for Democrats and Republicans https://t.co/TsggUEfOO2
,,6.0,1.0,6.0,20.0,2017.0,118606.0,871899511525961728,en,31048.0,Twitter for iPhone,"That's right, we need a TRAVEL BAN for certain DANGEROUS countries, not some politically correct term that won't help us protect our people!"
,,5.0,21.0,6.0,25.0,2017.0,58361.0,871840367070412800,en,12529.0,Twitter Ads,"Today, I announced an Air Traffic Control Initiative to take American air travel into the future - finally!
➡️… https://t.co/NIIorkSRJN"
,,5.0,20.0,6.0,45.0,2017.0,42473.0,871830255396192256,en,9450.0,Twitter Ads,".@SecShulkin's decision is one of the biggest wins for our VETERANS in decades. Our HEROES deserve the best! 
➡️… https://t.co/RnNp9q7Tdh"
,,5.0,13.0,6.0,49.0,2017.0,93115.0,871725780535062528,en,28318.0,Twitter for iPhone,"Pathetic excuse by London Mayor Sadiq Khan who had to think fast on his ""no reason to be alarmed"" statement. MSM is working hard to sell it!"
,,5.0,13.0,6.0,35.0,2017.0,78240.0,871722020278587393,en,20720.0,Twitter for iPhone,".@foxandfriends  Dems are taking forever to approve my people, including Ambassadors. They are nothing but OBSTRUCTIONISTS! Want approvals."
,,5.0,10.0,6.0,44.0,2017.0,87748.0,871679061847879682,en,19741.0,Twitter for iPhone,In any event we are EXTREME VETTING people coming into the U.S. in order to help keep our country safe. The courts are slow and political!
,,5.0,10.0,6.0,37.0,2017.0,64669.0,871677472202477568,en,14651.0,Twitter for iPhone,The Justice Dept. should ask for an expedited hearing of the watered down Travel Ban before the Supreme Court - &amp; seek much tougher version!
,,5.0,10.0,6.0,29.0,2017.0,69955.0,871675245043888128,en,15148.0,Twitter for iPhone,"The Justice Dept. should have stayed with the original Travel Ban, not the watered down, politically correct version they submitted to S.C."
,,5.0,10.0,6.0,25.0,2017.0,87432.0,871674214356484096,en,21347.0,Twitter for iPhone,"People, the lawyers and the courts can call it whatever they want, but I am calling it what we need and what it is, a TRAVEL BAN!"
,,4.0,11.0,6.0,43.0,2017.0,163023.0,871331574649901056,en,48861.0,Twitter for iPhone,Do you notice we are not having a gun debate right now? That's because they used knives and a truck!
,,4.0,11.0,6.0,31.0,2017.0,158189.0,871328428963901440,en,61560.0,Twitter for iPhone,"At least 7 dead and 48 wounded in terror attack and Mayor of London says there is ""no reason to be alarmed!"""
,,4.0,11.0,6.0,19.0,2017.0,239348.0,871325606901895168,en,73835.0,Twitter for iPhone,We must stop being politically correct and get down to the business of security for our people. If we don't get smart it will only get worse
,,3.0,23.0,6.0,24.0,2017.0,259347.0,871145660036378624,en,63752.0,Twitter for iPhone,"Whatever the United States can do to help out in London and the U. K., we will be there - WE ARE WITH YOU. GOD BLESS!"
,,3.0,23.0,6.0,17.0,2017.0,174224.0,871143765473406976,en,52333.0,Twitter for iPhone,"We need to be smart, vigilant and tough. We need the courts to give us back our rights. We need the Travel Ban as an extra level of safety!"
,,3.0,23.0,6.0,1.0,2017.0,0.0,871139911298101248,en,7453.0,Twitter for iPhone,RT @DRUDGE_REPORT: Fears of new terror attack after van 'mows down 20 people' on London Bridge...
,,3.0,19.0,6.0,35.0,2017.0,51084.0,871087981225926656,und,11947.0,Twitter Ads,#WeeklyAddress🇺🇸 https://t.co/DNzRZiKxhd
,,2.0,18.0,6.0,30.0,2017.0,76998.0,870709271477932032,und,16178.0,Twitter for iPhone,"#MakeAmericaGreatAgain🇺🇸
https://t.co/eJxeVZ3A1r"
,,2.0,10.0,6.0,40.0,2017.0,0.0,870590911222349824,und,10933.0,Twitter for iPhone,RT @EricTrump: #MakeAmericaGreatAgain!!! 🇺🇸🇺🇸 https://t.co/MStWl628xe
,,2.0,10.0,6.0,35.0,2017.0,0.0,870589692294647808,en,1967.0,Twitter for iPhone,RT @HeyTammyBruce: Coming up at 720a ET on @foxandfriends! See you there! 🇺🇸 #maga
,,2.0,10.0,6.0,34.0,2017.0,0.0,870589482675916800,en,7386.0,Twitter for iPhone,RT @LindseyGrahamSC: I support President Trump’s desire to re-enter the Paris Accord after the agreement becomes a better deal for America…
,,2.0,10.0,6.0,33.0,2017.0,0.0,870589212978032640,en,8827.0,Twitter for iPhone,RT @Reince45: Promise kept. @POTUS exits flawed #ParisAccord to seek better deal for U.S. workers &amp; economy. This WH will always put #Ameri…
,,2.0,10.0,6.0,32.0,2017.0,0.0,870588968475275264,en,8062.0,Twitter for iPhone,RT @GOPLeader: .@POTUS made the right call in leaving a deal that would have put an unnecessary burden on the United States. https://t.co/q…
,,2.0,10.0,6.0,32.0,2017.0,0.0,870588844793581569,en,9256.0,Twitter for iPhone,RT @Jim_Jordan: President Trump did the right thing by withdrawing us from Paris treaty - it would hurt American companies and American wor…
,,2.0,10.0,6.0,31.0,2017.0,0.0,870588565595578370,en,9437.0,Twitter for iPhone,"RT @VP: Our President is choosing to put American jobs, American consumers, American energy, and American industry first. https://t.co/y2Op…"
,,2.0,10.0,6.0,8.0,2017.0,0.0,870582867084050432,en,9395.0,Twitter for iPhone,RT @foxandfriends: Wall Street hits record highs after Trump pulls out of Climate pact https://t.co/PDmwj13Lus
,,2.0,1.0,6.0,0.0,2017.0,160788.0,870445001125355522,en,47701.0,Twitter for iPhone,MAKE AMERICA GREAT AGAIN!
,,1.0,22.0,6.0,50.0,2017.0,91434.0,870412262900740096,en,22129.0,Twitter Ads,"My job as President is to do everything within my power to give America a level playing field. #AmericaFirst🇺🇸
➡️… https://t.co/hL7OwbWzyi"
,,1.0,19.0,6.0,3.0,2017.0,37790.0,870355056327000065,en,7025.0,Twitter for iPhone,"Join me live at the @WhiteHouse.

➡️https://t.co/9VOb99W42r https://t.co/sjb5VHLHYH"
,,1.0,11.0,6.0,5.0,2017.0,90463.0,870234811616677889,en,25142.0,Twitter for iPhone,"The big story is the ""unmasking and surveillance"" of people that took place during the Obama Administration."
,,1.0,1.0,6.0,5.0,2017.0,77926.0,870083798981111808,en,17147.0,Twitter for iPhone,"I will be announcing my decision on Paris Accord, Thursday at 3:00 P.M.  The White House Rose Garden.  MAKE AMERICA GREAT AGAIN!"
